{
  "name": "mlb_simple",
  "projectId": "sferrazza-cloud-sandbox",
  "accessControl": {
    "datasetId": "access_control",
    "viewId": "groupEntities"
  },
  "groups": [{
      "name": "newyork_users",
      "access": [{
        "userByEmail": "benjentargaryen.327201@gmail.com"
      }]
    },
    {
      "name": "chicago_users",
      "access": [{
        "userByEmail": "melisandresnow.388027@gmail.com"
      }]
    }
  ],
  "datasets": [{
      "name": "ny_fans",
      "groupNames": [
        "newyork_users"
      ],
      "accessControlLabels": [
        "NY1",
        "NY2",
        "NY3",
        "NY4",
        "NYA",
        "NYN",
        "NYP"
      ]
    },
    {
      "name": "chicago_fans",
      "groupNames": [
        "chicago_users"
      ]
    }
  ],
  "views": [{
      "datasetNames": [
        "ny_fans"
      ],
      "name": "ny_game_logs",
      "expiration": {
        "delete": true,
        "time": 1597944246000
      },
      "source": {
        "datasetId": "mlb",
        "tableId": "game_logs",
        "accessControl": {
          "enabled": true,
          "datasetEnabled": false,
          "labelColumn": "label",
          "labelColumnDelimiter": "|"
        },
        "publicAccess": {
          "enabled": true,
          "queryFilter": "h_game_number = 1 or v_game_number = 1",
          "limit": 20
        }
      }
    },
    {
      "datasetNames": [
        "chicago_fans"
      ],
      "name": "chicago_game_logs",
      "source": {
        "datasetId": "mlb",
        "tableId": "game_logs",
        "accessControl": {
          "enabled": true,
          "datasetEnabled": false,
          "labelColumn": "label",
          "labels": [
            "CH1",
            "CH2",
            "CHA",
            "CHF",
            "CHN",
            "CHP",
            "CHU"
          ]
        }
      }
    }
  ]
}
